{"pred_trigger_in_text": "bogota , 18 jul 89 ( efe ) -- ( text ) the colombian police today rescued manuel vallejo uribe , a businessman , who they found unharmed. during the rescue operation , the police [ killed | trigger for kidnapping event ] six kidnappers , according to an offical police report. vallejo uribe , 32 , was released in bello , near medellin , the second largest city in colombia , as the result of intelligence gathered by the metropolitan police , police sources added. the businessman , who owns a tannery and spends most of his time in miami , was kidnapped on 9 july by several unknown persons. the police reported that during the bello rescue operation , six kidnappers , all common criminals who tried to prevent the police from rescuing him , were killed .\n", "pred_triggers": [], "gold_templates": [{"incident_type": "kidnapping", "PerpInd": [["unknown persons"]], "PerpOrg": [], "Target": [], "Victim": [["manuel vallejo uribe"]], "Weapon": []}], "doctext": "   bogota, 18 jul 89 (efe) -- (text) the colombian police today rescued manuel vallejo uribe, a businessman, who they found unharmed. during the rescue operation, the police killed six kidnappers, according to an offical police report.       vallejo uribe, 32, was released in bello, near medellin, the second largest city in colombia, as the result of intelligence gathered by the metropolitan police, police sources added.     the businessman, who owns a tannery and spends most of his time in miami, was kidnapped on 9 july by several unknown persons.       the police reported that during the bello rescue operation, six kidnappers, all common criminals who tried to prevent the police from rescuing him, were killed.  ", "entities": [{"type": "template entity", "start": 102, "end": 104}, {"type": "template entity", "start": 17, "end": 20}], "triggers": [{"type": "trigger for kidnapping event", "start": 35, "end": 36}], "relations": [{"type": "perpetrating individual argument for kidnapping event", "head": 0, "tail": 0}, {"type": "victim argument for kidnapping event", "head": 1, "tail": 0}], "tokens": ["bogota", ",", "18", "jul", "89", "(", "efe", ")", "--", "(", "text", ")", "the", "colombian", "police", "today", "rescued", "manuel", "vallejo", "uribe", ",", "a", "businessman", ",", "who", "they", "found", "unharmed.", "during", "the", "rescue", "operation", ",", "the", "police", "killed", "six", "kidnappers", ",", "according", "to", "an", "offical", "police", "report.", "vallejo", "uribe", ",", "32", ",", "was", "released", "in", "bello", ",", "near", "medellin", ",", "the", "second", "largest", "city", "in", "colombia", ",", "as", "the", "result", "of", "intelligence", "gathered", "by", "the", "metropolitan", "police", ",", "police", "sources", "added.", "the", "businessman", ",", "who", "owns", "a", "tannery", "and", "spends", "most", "of", "his", "time", "in", "miami", ",", "was", "kidnapped", "on", "9", "july", "by", "several", "unknown", "persons.", "the", "police", "reported", "that", "during", "the", "bello", "rescue", "operation", ",", "six", "kidnappers", ",", "all", "common", "criminals", "who", "tried", "to", "prevent", "the", "police", "from", "rescuing", "him", ",", "were", "killed", "."], "raw_output": ["trigger_output_sentence bogota , 18 jul 89 ( efe ) -- ( text ) the colombian police today rescued manuel vallejo uribe , a businessman , who they found unharmed. during the rescue operation , the police [ killed | trigger for kidnapping event ] six kidnappers , according to an offical police report. vallejo uribe , 32 , was released in bello , near medellin , the second largest city in colombia , as the result of intelligence gathered by the metropolitan police , police sources added. the businessman , who owns a tannery and spends most of his time in miami , was kidnapped on 9 july by several unknown persons. the police reported that during the bello rescue operation , six kidnappers , all common criminals who tried to prevent the police from rescuing him , were killed .\n", " triggers {('trigger for kidnapping event', 35, 36)}\n", "predicted_relations {('perpetrating individual argument for kidnapping event', (37, 38), ('trigger for kidnapping event', 35, 36)), ('victim argument for kidnapping event', (17, 20), ('trigger for kidnapping event', 35, 36))}\n", " gt_relations {('perpetrating individual argument for kidnapping event', (102, 104), ('trigger for kidnapping event', 35, 36)), ('victim argument for kidnapping event', (17, 20), ('trigger for kidnapping event', 35, 36))}\n"], "pred_relations": [[["perpetrating individual argument for kidnapping event", [37, 38], ["trigger for kidnapping event", 35, 36]], ["victim argument for kidnapping event", [17, 20], ["trigger for kidnapping event", 35, 36]]]], "pred_templates": [{"incident_type": "kidnapping", "PerpInd": [["kidnappers"]], "PerpOrg": [], "Target": [], "Victim": [["manuel vallejo uribe"]], "Weapon": []}]}